title,description
Will Third-Party Candidates Be 2024 Spoilers? Here’s What To Know—As Trump-Harris Race Nearly Tied.,"The swing states—primed to decide the election in 2024—have third-party candidates on their ballots, which could skew a winning margin in November."
Trump co-defendant Kenneth Chesebro suspended from practicing law in New York,"A state appellate court in New York suspended Kenneth Chesebro, who struck a plea deal with prosecutors pursuing the 2020 election interference case against former President Donald Trump, from practicing law there."
Michigan 2024 Trump-Harris Polls: Harris Leads Narrowly In Latest Survey,Biden flipped Michigan in the 2020 election.
Trump booster quits Washington Post after livestream meltdown,"Hugh Hewitt has quit the Washington Post, but his storming off has nothing to do with the paper's decision to withhold presidential endorsements. In an exclusive report, the New York Post revealed that Hewitt was live on air with colleagues Jonathan Capehart …"
"Treasury Yields Rise To 3-Month High As Concerns Mount About National Debt Under Harris, Trump Policies","Harris and Trump are suggesting tax cuts and federal programs which require major spending “like Mardi Gras beads,” quipped a billionaire investor."
"Trump says he will ""protect women"" whether they ""like it or not""","While campaigning in Green Bay, Wisconsin, on Wednesday, former President Donald Trump told a crowd that ""whether the women like it or not, I'm going to protect them.'"" Vice President Kamala Harris called the remarks ""offensive to women."" Nikole Killion repor…"
Speaker Mike Johnson criticizes Obamacare and promises 'massive reform' if Trump wins,House Speaker Mike Johnson said there will be “massive” changes to health care and Obamacare if Donald Trump and Republicans win the election.
"WATCH: Trump Gets Warm Welcome in Majority-Arab Dearborn, Michigan","Former President Donald Trump became the first major party presidential candidate to visit Dearborn, Michigan, on Friday, venturing into the majority-Arab and predominantly Muslim town, which had once been hostile territory.
The post WATCH: Trump Gets Warm We…"
Key Trump ally Steve Bannon released from prison,"Just a week before Election Day, Steve Bannon, former White House chief strategist in the Trump administration, was released from federal prison after serving four months for contempt of Congress when he refused to cooperate with the House select committee in…"
"Trump talks economy, immigration and unfounded election doubts",Former President Donald Trump mixed messages about the economy and immigration with unfounded doubts about the election in Pennsylvania as his campaign makes its final pitches to voters ahead of Election Day. Trump will rally in North Carolina and Pennsylvani…
"A Fox News Host Seemingly Tried To Defend Trump Allegedly Saying He Wanted ""Generals Like Hitler Had,"" And It's Quite The Statement","""Coming from the business world...obviously [Trump] has frustration.""View Entire Post ›"
Tariffs hurt his business. He's voting for Trump anyway,"Donald Trump's call for sweeping tariffs is resonating, as protectionism gains steam in the US."
‘Couch Potato Voters’ Could Help Trump Defeat Kamala Harris: Top Pollster,"On ""Forbes Newsroom,"" HarrisX Founder and CEO Dritan Nesho discussed a new HarrisX/Forbes Poll showing a statistically tied race for the presidency between vice president Kamala Harris and former president Donald Trump."
"Harris says she thinks Trump is a fascist, Trump supporters brushing off claims from John Kelly","Vice President Kamala Harris told a CNN town hall Wednesday night that she thinks former President Donald Trump is a fascist and that ""the people who know him best on the subject should be trusted."" Harris' comments come after Trump's former chief of staff, J…"
Could John Kelly's Trump warning sway voters?,"Between campaign events, Vice President Kamala Harris and former President Donald Trump are reacting to recent comments from Trump's longest-serving chief of staff, John Kelly. In an interview with The New York Times, Kelly said the former president ""certainl…"
"Trump Vs. Harris 2024 Polls: Tie In Final NYT/Siena Poll, As Race Narrows Weeks Before Election Day",Most polls indicate a tight race between Donald Trump and Kamala Harris.
"Tim Walz: Trump Pandered To, Disrespected McDonald's Workers","Democratic Vice Presidential nominee Gov. Tim Walz (D-MN) said Monday on ABC's ""The View"" that former President Donald Trump pandered and disrespected McDonald's workers with his appearance at a Pennsylvania McDonald's franchise.
The post Tim Walz: Trump Pand…"
How Courts Are Impacting 2024 Election: Pennsylvania County’s Early Voting Extended After Trump Campaign Sues,Courts are responding to lawsuits across the country on how ballots and voter rolls are handled in the weeks before Election Day.
"House panel finds Trump assassination event ""preventable"" in interim report","The House task force investigating the shooting said in the report that there were ""stunning security failures"" leading up to the shooting."
"Harris leans on star power, Trump targets Cheney on Carlson interview","Actress Jeniffer Lopez and Mexican rock band Maná joined Vice President Kamala Harris at a campaign rally in Las Vegas, Nevada, Thursday, the same day former President Donald Trump attacked former Rep. Liz Cheney, a Harris campaign surrogate, during a live in…"
Wisconsin 2024 Trump-Harris Polls: Harris Leads In 5 New Surveys—As Others Show A Near-Tie,"Biden flipped Wisconsin in 2020, but it's expected to be close this year."
"Harris and Beyoncé in Texas, Trump joining Rogan podcast","Vice President Kamala Harris and former President Donald Trump will both be in Texas campaigning Friday. Harris will rally Houston voters with Beyoncé. CBS News' Scott MacFarlane has more on her expected remarks. Also, Trump will be in Austin to discuss immig…"
Nevada 2024 Trump-Harris Polls: Latest Survey Shows A Tie—As Harris Struggles With Latinos,Nevada has voted for Democrats in every presidential election since 2008.
"Harris speech at Ellipse to offer ""a different path"" than Trump","Vice President Kamala Harris will deliver remarks at the same spot Trump inspired his supporters to march to Capitol on Jan. 6, 2021."
Trump Vs. Harris 2024 Polls: Harris Leads In 4 Latest Surveys,Most polls indicate a tight race between Donald Trump and Kamala Harris.
Whoopi Goldberg Calls Out Joe Rogan’s ‘Fake News’ About ‘The View’ Once Loving Trump; 2011 Interview Shows Goldberg Slamming Trump’s ‘B.S.’ to His Face,Whoopi Goldberg put Joe Rogan in his place during an episode of “The View” in which the EGOT winner corrected Rogan’s false claims about one of Trump’s appearances on the ABC daytime talk show. Trump recently guested on Rogan’s Spotify podcast “The Joe Rogan …
"Harris and Trump tied in Pennsylvania with 1 week left, CBS News poll finds",The 2024 presidential race is tied in Pennsylvania one week from Election Day. A new CBS News poll finds that Vice President Kamala Harris and former President Donald Trump have 49% there. CBS News executive director of elections and surveys Anthony Salvanto …
Comedian At Donald Trump Rally Calls Puerto Rico ‘Floating Island Of Garbage’,The Harris campaign criticized Tony Hinchcliffe—who responded that “people have no sense of humor.”
Trump and Harris make final appeals in Georgia as polls show tight race,"As the presidential race tightens, former President Donald Trump and Vice President Kamala Harris campaign in Georgia, where our battleground tracker indicates a narrow lead for Trump. CBS News' Nikole Killion has more from Atlanta."
North Carolina race tightens as Trump holds narrow lead over Harris,"With the battleground tracker showing a slim lead for former President Donald Trump, the race in North Carolina remains too close to call. CBS News' Skyler Henry reports from North Carolina, where voters weigh in on the candidates."
Biden turns tables on Trump: 'Lock him up' — politically,"""Lock her up"" chants that became popular at former President Donald Trump's campaign rallies in 2016 got flipped around Tuesday by President Joe Biden, who told campaign workers in New Hampshire on Tuesday, ""We’ve got to lock him up"" then added after a brief …"
"Poll: Trump Leads in Michigan and Wisconsin, Senate Races Tied","A poll shows Donald Trump leading Kamala Harris in Michigan and Wisconsin with the U.S. Senate races virtually tied.
The post Poll: Trump Leads in Michigan and Wisconsin, Senate Races Tied appeared first on Breitbart."
Significance of Harris' closing argument at park where Trump spoke before Jan. 6 attack,"Vice President Kamala Harris will deliver her closing argument Tuesday night at the same location where former President Donald Trump spoke on Jan. 6, 2021, and told his supporters the 2020 election was stolen. CBS News chief election and campaign corresponde…"
"Republicans are mobilizing expat votes for Trump in Israel, hoping to tip the scale in battleground states",Republicans in Israel are targeting the country's American expat community—the world's fourth-largest—hoping it tips the scale in a close election.
Harris Says Trump Is A Fascist In CNN Town Hall,Harris was speaking about Trump’s reported praise of Hitler and his desire to use the military to go after his political enemies.
Trump Media Shares Halted Repeatedly For Volatile Trading—After Price Spikes And Drops,Shares in the Truth Social parent firm briefly surged before turning negative.
Democrats Target McDonald's for Price Gouging After Trump Served Customers,"Senate Democrats attacked McDonald's on Tuesday for price gouging while it continues to ""grow"" profits and serve the needs of customers. 
The post Democrats Target McDonald’s for Price Gouging After Trump Served Customers  appeared first on Breitbart."
Georgia 2024 Trump-Harris Polls: Trump Has Narrow Lead In New Poll—As GOP Aims To Reclaim State,Biden was the first Democratic presidential candidate to win Georgia since 1992.
"Harris, Trump back on trail after Trump MSG rally overshadowed by offensive remarks",Former President Donald Trump's campaign sought to distance themselves from an offensive joke about Puerto Rico at Madison Square Garden before Trump spoke.
"Kamala Harris reacts to Trump saying he'll protect women ""whether the women like it or not""","Vice President Kamala Harris spoke to reporters in Wisconsin Thursday about former President Donald Trump's comments that he would protect women ""whether the women like it or not."" Harris said the remark speaks to how Trump thinks about women and their agency…"
Singer Joni Mitchell Screams 'F**k Trump' at Hollywood Bowl,"Singer and folk music icon Joni Mitchell took a vulgar swipe at former President Donald Trump at the Hollywood Bowl in Los Angeles.
The post Singer Joni Mitchell Screams ‘F**k Trump’ at Hollywood Bowl appeared first on Breitbart."
'Due to Donald Trump': MSNBC's Mika cries during harrowing interview,"""Morning Joe"" co-host Mika Brzezinski brushed away tears Friday morning as a Georgia mother told how Donald Trump's actions as president pushed her to the brink of death upon the loss of a ""very wanted"" child. Avery Davis Bell appeared on MSNBC Friday morning…"
Inside New Minnesota Poll Showing Kamala Harris With Narrow 3-Point Edge Over Trump,"On ""Forbes Newsroom,"" Ana Radelat, the Washington Correspondent for MinnPost, discussed a new MinnPost-Embold Research poll showing Harris slightly ahead of Trump in MN."
Central Park Five members file defamation lawsuit against Trump,The so-called Central Park Five were exonerated and their convictions tossed out in 2002.
Trump campaign adviser says comedian's jokes were ad-libbed at Madison Square Garden rally,Former President Donald Trump's campaign is still trying to distance itself from the offensive comments and jokes made by comedian Tony Hinchcliffe at Trump's Madison Square Garden rally. CBS News campaign reporter Libby Cathey has more.
Trump Hasn’t Spent A Dime Of His Own Money On His 2024 Campaign,"The campaign and political committees of billionaire presidential candidate Donald Trump have paid his businesses millions for air travel, lodging, catering and more."
Trump holds townhall with Latino voters in Florida,"Former President Trump held a town hall with Latino voters at his Doral golf club in Florida on Tuesday. While he criticized the conditions at the U.S.-Mexico border, his rhetoric toward undocumented immigrants was much less harsh than his usual comments on t…"
Democrats confront a tougher road in New York amid the Harris-Trump race,Former President Donald Trump’s promises that he’ll win New York are more empty bluster than evidence-based prediction.
"Harris and Béyonce in Texas, Trump joining Rogan podcast","Vice President Kamala Harris and former President Donald Trump will both be in Texas campaigning Friday. Harris will rally Houston voters with Beyoncé. CBS News' Scott MacFarlane has more on her expected remarks. Also, Trump will be in Austin to discuss immig…"
"Biden remark about Trump ""garbage"" rally angers GOP","Biden was responding to a joke made at a Trump rally by comedian Tony Hinchcliffe, in which Hinchcliffe called Puerto Rico a ""floating island of garbage."""
'Trump Is Literally Hitler' Post On X Crossed The Line On Satire,"The line between news and satire has blurred so much that the latter has been shared on social media as fact, where it quickly spreads misinformation."
Why was Trump serving fries in McDonald’s?,The BBC's Lily Jamali explains the backstory behind the former president's campaign stunt.
"The data behind where Harris, Trump make campaign stops","With 15 days until Election Day, where candidates go can be crucial to their chances of winning. CBS News executive director of elections and surveys Anthony Salvanto explains why Vice President Kamala Harris and former President Donald Trump are heading to c…"
Tim Walz wins cheers by using Trump phrase against him,"Minnesota Gov. Tim Walz on Thursday threw former President Donald Trump's words back in his face during a campaign stop in Bucks County, Pennsylvania.

While speaking with voters in the crucial Pennsylvania swing county, Walz made a reference to Trump's state…"
"Offensive comments taking off before Trump, Harris race ends","Offensive comments made in the last days before the Nov. 5 election are shadowing a key week for both presidential candidates to sway 2024 undecided voters. Former President Donald Trump's comments about former Rep. Liz Cheney are drawing criticism, while Vic…"
Puerto Rican artist Nicky Jam takes back his Trump endorsement,"Reggaeton artist Nicky Jam on Wednesday revoked his endorsement of Donald Trump, after Tony Hinchcliffe's rally joke calling Puerto Rico ""garbage."""
"Harris campaign pounces on Trump rally "" garbage"" remarks in push for Latino vote",Harris' campaign believes that rhetoric is helping boost Harris with late-breaking battleground voters — by double digits.
Trump pledges to fire special counsel Jack Smith,"In an interview Thursday, former President Donald Trump said that if he wins the election, he plans to immediately fire special counsel Jack Smith, the man who is overseeing two key criminal investigations against Trump, including the 2020 election interferen…"
Pennsylvania 2024 Trump-Harris Polls: Trump Up 1 Point In Latest Survey,Pennsylvania has voted for 10 of the last 12 White House winners.
"Donald Trump Just Shared An Odd Story About Arnold Palmer's Penis Size, And Jon Stewart Had A Surprising Reaction",The Daily Show host argued there's a bigger and more important issue at hand.View Entire Post ›
Hillary Clinton says she’s not worried about Trump retaliation,Former Secretary of State Hillary Clinton said she’s not worried about former President Trump retaliating against her if he wins the 2024 presidential...
"Harris, Trump in Texas with 11 days until Election Day","The presidential candidates are in the Lone Star State on Friday. Vice President Kamala Harris will team up with Beyoncé, while former President Donald Trump will sit down with Joe Rogan. CBS News' Zak Hudak and Fin Gómez have the latest on the state of the 2…"
Trump Media Is Now Worth More Than Elon Musk’s X After Stock Rallies to New Highs,"Trump Media & Technology Group, which operates the Truth Social social-media network, has seen its stock soar in the weeks leading up to the Nov. 5 presidential election — and it is currently worth more than Elon Musk’s X, the social-media company formerly kn…"
Donald Trump Praised by Arab-Americans in Dearborn: 'Look to Trump Presidency with Hope',"Former President Donald Trump was praised by Arab-Americans in Dearborn, Michigan, on Friday, who revealed that they were looking to a ""Trump presidency with hope.""
The post Donald Trump Praised by Arab-Americans in Dearborn: ‘Look to Trump Presidency with Ho…"
NBC Airs Trump Message After FCC Commissioner Flags ‘Equal Time’ Concerns Over Harris SNL Appearance,"On Saturday, FCC Commissioner Brendan Carr criticized Harris’ Saturday Night Live appearance as a “blatant effort” by the network to evade the agency’s “Equal Time rule.”"
Arizona 2024 Trump-Harris Polls: Race Effectively Tied In New Swing State Survey,"President Joe Biden narrowly won the battleground state in 2020 over Trump, who sought to overturn election results in the state."
Watch: Biden says ‘lock Trump up...politically’,The president made the comments during a Democratic Party headquarters visit in New Hampshire on Tuesday.
Sen. Rick Scott denounces anti-Puerto Rico comment at Trump rally,"Derogatory comments directed at Puerto Rico from former President Donald Trump's Madison Square Garden Rally have sparked outrage from both sides of the aisle. Political strategists Chuck Rocha and Bryan Lanza join ""America Decides"" to discuss the fallout."
Trump looks to gain support from Latino voters while campaigning in Southwest,Former President Donald Trump campaigned in Arizona Thursday where he repeated false claims about Democrats in 2020. He also criticized Vice President Kamala Harris on immigration and the economy.
See how Trump and Harris' stances on military support compare,"There are similarities between Trump and Biden on long-term armed forces strategy, but the 2024 election shows stark differences in Harris and Trump's view of the military's role."
The vulnerable GOP congressman convinced that economic interest voters will save him from the Trump and abortion backlash,"In Scottsdale, Rep. David Schweikert hopes an old-school GOP approach can help him hold onto a House district that's increasingly turning blue."
Report: Amish Possible Key Demographic in Trump Winning Pennsylvania,"Amish voters in the upcoming presidential election may be an important demographic in former President Donald Trump winning Pennsylvania.
The post Report: Amish Possible Key Demographic in Trump Winning Pennsylvania appeared first on Breitbart."
Donald Trump Movie ‘The Apprentice’ New On Digital Streaming This Week,“The Apprentice”—a biopic about the rise of Donald Trump as a real estate mogul—is new on digital streaming this week. Find out when and where you can watch it at home.
Harris Retakes Election Odds Lead With Betting Market—As Trump Remains Favorite,Election prediction markets have recently tilted toward Harris as Election Day nears.
Daughter of NFL Legend Endorses Trump: 'I Opened My Eyes',"The daughter of legendary NFL Hall of Famer Jim Brown has endorsed former President Trump, citing his support for the black community during his first term in office.
The post Daughter of NFL Legend Endorses Trump: ‘I Opened My Eyes’ appeared first on Breitba…"
How Badly Will Trump Plan Reduce Your Social Security Benefits?,American are worried about how they can afford to live in retirement. Trump alludes to a Social Security plan  that could reduce by benefits by 1/3.
Pennsylvania Is This Year’s Most Crucial Swing State—Here’s How Harris Or Trump Could Still Win Without It,The winner in Pennsylvania will most likely take the 2024 election—but either candidate could win without the Keystone State.
Trump vs. Harris: Here?s Who?s Raised More In Battleground States | Forbes Topline,"Former President Donald Trump and Vice President Kamala Harris have collectively raised $154 million in the seven biggest battleground states, and while Harris? fundraising has far surpassed Trump?s overall, the ex-president is within striking distance of her…"
Puerto Rican Billionaire Slams ‘Hurtful’ Comments At Trump MSG Rally,"Buyout tycoon José E. Feliciano speaks out against a Trump surrogate’s disparaging remarks about Puerto Rico, and urges his fellow Americans to vote."
Trump argues Smith unlawfully appointed in documents and election cases,Former President Donald Trump urged two separate courts to toss out the cases brought against him by special counsel Jack Smith.
"Election 2024 Swing State Polls: Trump Leads Harris In North Carolina And Arizona, Tie In Georgia (Updated)","While Harris has a slight lead nationally, there's no clear leader in the seven swing states likely to decide the election."
Election 2024 live updates amid tight Harris-Trump polls in final campaign stretch,"Follow live as Vice President Kamala Harris and former President Donald Trump enter the final weekend of the campaign in the 2024 election, as polls remain tight."
Election 2024 live updates as Trump vs. Harris polls show tie just 5 days out,"Former President Donald Trump tried to seize on the ""garbage"" comments at a truck in Wisconsin while Vice President Harris will have a campaign event with J.Lo in Las Vegas."
Trump mass deportation plan could cost billions a year,"Immigration experts say Donald Trump's mass deportation plan, if carried out, could be complicated and cost billions a year. It could also lead to more family separations."
"What Harris, Trump campaigns are zeroing in on ahead of Election Day","Former President Donald Trump and Vice President Kamala Harris are looking to emphasize their key campaign messages in the homestretch of the 2024 election. Both candidates also reacted to President Joe Biden's ""garbage"" comments. CBS News' Libby Cathey, Weij…"
"Election 2024 Swing State Polls: Near-Tie In ‘Blue Wall,’ As Trump Commands Arizona And Harris Leads Nevada (Updated)",There's no clear leader in the seven swing states likely to decide the election.
Trump accuses Britain's ruling Labour Party of election interference,Former President Donald Trump accused Keir Starmer's British Labour Party of illegally assisting Vice President Kamala Harris ahead of the election Nov. 5.
The Polar Opposite Tax Policies Of Harris And Trump,"Harris backs tax cuts for low- and moderate-income households. Trump has proposed big tariffs and tax cuts aimed at specific, but disparate, constituencies."
Trump campaign debuts Halloween-themed billboards,"The Trump campaign will place billboards in Erie, Pennsylvania; near Marquette University in Milwaukee, Wisconsin; and in Las Vegas."
Georgia 2024 Trump-Harris Polls: Harris Leads By 4 In Latest Survey—But Averages Show Trump Ahead,Biden was the first Democratic presidential candidate to win Georgia since 1992.
"Trump repeats false claims of ""rampant cheating"" in 2020 election","Former President Donald Trump made new threats Friday to hold people accountable for what he calls ""rampant cheating"" in the 2020 election. There is no evidence of widespread fraud during 2020, but that isn't stopping Trump and his allies from raising concern…"
CBS News Harris-Trump Poll: All tied up in Pennsylvania,"More voters say they would be better off financially with Trump, but more think Harris has the cognitive health to serve."
"Nolte: Poll Shows Trump +2 Nationally, +8 in Swing States","Trump has never polled better than he is polling right now.
The post Nolte: Poll Shows Trump +2 Nationally, +8 in Swing States appeared first on Breitbart."
Michigan 2024 Trump-Harris Polls: Harris Takes 3-Point Lead In Latest Polls,Biden flipped Michigan in the 2020 election.
"Gay Men Are Dragging J.D. Vance After He Said He Wouldn't Be Surprised If He And Trump Won ""The Normal Gay Guy Vote""","What exactly is a ""normal gay guy vote""?View Entire Post ›"
