title,description
"Racist comments at Trump NYC rally, Michelle Obama makes case for Harris",Reactions to insults hurled at Donald Trump's Madison Square Garden rally are still emerging as the former president heads to Georgia to campaign. This comes as Vice President Kamala Harris makes a trip to the battleground state of Michigan after appearing at…
"Watch Live: Donald Trump Holds Rally in Salem, Virginia","Former President Donald Trump speaks to supporters at a rally in Salem, Virginia, on Saturday, November 2.
The post Watch Live: Donald Trump Holds Rally in Salem, Virginia appeared first on Breitbart."
"Whether Harris Or Trump Wins, Social Media Ensures We Remain Divided","The age of the anti-social networks is already in full swing, and the platforms will almost make sure we remain divided."
Donald Trump’s Net Worth Rises $460 Million As Trump Media Shares Surge,Trump Media’s share price has more than doubled since reaching a record low in September.
"Prime Video’s ‘The Boys’ Mocks Trump’s McDonald’s Stint With Homelander, Its Trump-Like Antagonist","The series’ creators have previously compared its antagonist, the narcissistic and dangerously ambitious superhero Homelander, to Trump."
NYT's Nate Cohn: Donald Trump Could Win Popular Vote,"Former President Donald Trump could win the popular vote, the New York Times's Nate Cohn wrote Friday, which would provid the former president with a mandate.
The post NYT’s Nate Cohn: Donald Trump Could Win Popular Vote appeared first on Breitbart."
Harris says ‘of course’ her team is prepared if Trump declares victory before votes are counted,"In an interview with NBC News’ Hallie Jackson on Tuesday, Vice President Kamala Harris said she's preparing for the possibility that former President Donald Trump declares victory before the votes are counted in this next month's election."
Trump Media extends rally to 280% as MSG event spurs meme-stock activity,Shares in the Truth Social parent company jumped as much as 22% on Monday after the former president's rally in Manhattan.
Playing The U.S. Elections - Part 1: Stocks To Pick If You Favor Trump,The U.S. Presidential election is nearing its curtain call. Which stocks are likely to do well if Trump wins?
Truth Social Stock Jumps 20% As Trump’s Betting Odds Rise—Trump Net Worth Up $3.7 Billion This Month,Shares of the social media company are up 200% over the last month.
Trump Says ‘I Don’t Know’ Comedian Who Made Puerto Rico Joke—But Stops Short Of Denouncing It,Trump responded to Hinchcliffe’s widely rebuked remark for the first time in an ABC News story published Tuesday.
"What Harris, Trump are doing in the West right before Election Day",Vice President Kamala Harris and former President Donald Trump are visiting the West just days before the Nov. 5 Election Day. CBS News political reporter Zak Hudak has more on the upcoming campaign moves.
Elon Musk is going 'founder mode' in his bid to get Donald Trump elected,Elon Musk's approach to helping Donald Trump get elected is similar to how the Tesla CEO runs businesses. It's not clear in this case if it'll work.
Arizona 2024 Trump-Harris Polls: Race Virtually Tied In 3 New Surveys,"President Joe Biden narrowly won the battleground state in 2020 over Trump, who sought to overturn election results in the state."
Arizona 2024 Trump-Harris Polls: Trump Up 3 Points In Latest Survey,"President Joe Biden narrowly won the battleground state in 2020 over Trump, who sought to overturn election results in the state."
Trump Primary Challenger Sentenced To Over 15 Years On Tax Charges,"Castro wrote he ""failed to explain to clients that were not in  a position to understand and provide informed consent to such a novel and complex legal interpretation""."
"Trump, Harris make final push 8 days from Election Day","The 2024 presidential candidates entered their last full week of campaigning on Monday, with eight days left until Election Day. CBS News' Fin Gómez, Ed O'Keefe and Major Garrett have the latest."
Cheney slams 'tyrant' Trump for violent rhetoric,"Prominent Republican and vocal Donald Trump critic Liz Cheney called the former president a ""vindictive, cruel"" dictator on Friday after he suggested she would be less of a ""war hawk"" with guns trained on her face.""This is how dictators destroy free nations. …"
"Watch Live: Donald Trump Holds Rally in Gastonia, North Carolina","Former President Donald Trump speaks to supporters at a rally in Gastonia, North Carolina, on Saturday, November 2.
The post Watch Live: Donald Trump Holds Rally in Gastonia, North Carolina appeared first on Breitbart."
"Watch Live: Donald Trump Holds Rally in Lititz, Pennsylvania","Former President Donald Trump speaks to supporters at a rally in Lititz, Pennsylvania, on Sunday, November 3.
The post Watch Live: Donald Trump Holds Rally in Lititz, Pennsylvania appeared first on Breitbart."
"Kamala Harris warns of ""chaos and division"" in a second Trump term","With the Capitol and White House behind her, Vice President Kamala Harris presented a vision for unity, warning against what she describes as a dangerous return to a Trump presidency."
Legendary investor Paul Tudor Jones says he's buying gold and bitcoin pre-election because inflation will rise under both Trump and Harris,"""The playbook to get out of this is that you inflate your way out,"" Jones said about America's ballooning national debt."
"Harris Vs. Trump On The Economy: Americans Split On Who’s Better For Inflation, Jobs And Taxes",This is what polls suggest about Americans' leanings on Harris and Trump as the economy enters a new phase.
How Trump and Harris' health care stances and policy plans compare,A look at Kamala Harris and Donald Trump's stances on health care and what they've said about health care policy going into 2024 presidential election.
Georgia 2024 Trump-Harris Polls: Trump (Barely) Ahead In Most Final Surveys,Biden was the first Democratic presidential candidate to win Georgia since 1992.
Jamie Dimon Not Considering A Job With Harris Or Trump—But Reportedly Backs Harris,Dimon has not publicly endorsed a candidate in the 2024 presidential race.
"Harris chats with Cheney, Trump tours North Carolina Helene damage","Vice President Kamala Harris kicked off a set of appearances with former GOP Rep. Liz Cheney in Pennsylvania, Michigan and Wisconsin to court moderate voters in those key battleground states. Meanwhile, former President Donald Trump is in North Carolina, anot…"
Trump Media Stock (DJT) - A Meme Stock Plummet Can Be Hard To Stop,DJT's 4-day turnaround ends the fun
Trump Campaign Challenges Kamala Harris to Disavow Biden's 'Garbage' Insult,"The Trump-Vance campaign demanded Tuesday evening that Vice President Kamala Harris ""disavow"" President Joe Biden's comment that Trump supporters were ""garbage.""
The post Trump Campaign Challenges Kamala Harris to Disavow Biden’s ‘Garbage’ Insult appeared fir…"
"Harris campaign hits key states, Trump to rally in Wisconsin","Vice President Kamala Harris is campaigning in three key states a day after delivering what her campaign billed as her closing argument in a speech yesterday in Washington D.C. First, the vice president will deliver remarks in Raleigh, North Carolina, in the …"
Trump Vs. Harris On Immigration Deportation Or Path To Citizenship?,Donald Trump pledges to deport all immigrants within the U.S. without legal status. Kamala Harris calls for a Path to Citizenship for them. Who is right?
Melania Trump Makes Rare Appearance At Trump’s Madison Square Garden Rally,Melania Trump has been largely absent from her husband’s campaign trail this election cycle.
Nevada 2024 Trump-Harris Polls: Trump Up By 1 Point In Latest Survey—As Harris Struggles With Latinos,Nevada has voted for Democrats in every presidential election since 2008.
Trump spurs backlash with Cheney guns ‘trained on her face’ remarks,Former President Trump is spurring backlash with his comments about former Rep. Liz Cheney (R-Wyo.) in which he described her having guns “trained on her...
"Bad Bunny endorses Harris, Trump rally sparks controversy","With nine days until Election Day, Puerto Rico has been thrust into the spotlight by both campaigns."
"A look at the state of the Trump, Harris campaigns","With 12 days to go until Election Day, Robert Costa takes a big-picture view of the presidential race and what the Trump and Harris campaigns are prioritizing."
"Exclusive — JD Vance Response to Mark Cuban: ‘Insulting to My Wife,’ Melania Trump, Lara Trump and All Women Supporting Trump","Vice Presidential Candidate JD Vance responded to Mark Cuban's statement on The View that Donald Trump is never around ""strong, intelligent women.""
The post Exclusive — JD Vance Response to Mark Cuban: ‘Insulting to My Wife,’ Melania Trump, Lara Trump and All…"
Harris says Trump 'devalues' women's ability to make their own choices,"In an exclusive interview with NBC News, the vice president criticized Trump's comments about protecting women ""whether the women like it or not."""
North Carolina 2024 Trump-Harris Polls: Trump Up By 2 Points In 2 New Surveys,Polls show Trump and Harris are in a virtual tie for North Carolina’s 16 electoral college votes.
Former GOP Senator John Danforth: ‘Nobody Has Done More Damage To The Country’ Than Trump,"On “Forbes Newsroom,” former Missouri Senator John Danforth claimed that “nobody has done more damage to the country” than the 45th President."
Trump Vs. Harris 2024 Polls: Trump Up In 3 New Surveys—Harris Leads In 2 Others,Most polls indicate a tight race between Donald Trump and Kamala Harris.
Watch: Trump serves up McDonald’s fries and Harris celebrates birthday,The US presidential candidates continued to campaign across key swing states on Sunday.
Trump Takes Questions From Garbage Truck As Campaigns Seize On Each Other’s ‘Garbage’ Remarks,The stunt was done in response to a comment made by President Joe Biden in which he criticized a disparaging comment about Puerto Rico made at Trump’s recent New York rally and appeared to call Trump’s supporters garbage.
"One week out from the election, Jared Kushner and Ivanka Trump still say they're set on moving on from Trumpworld","""We're rooting for him — obviously, we're proud of him. But, you know, either way, our life will just continue to move forward,"" Kushner said of Trump."
Trump and his allies ramp up election fraud allegations in Pennsylvania,Donald Trump and his allies are seizing on routine election processes as signs of fraud in the critical battleground state of Pennsylvania.
"Report: Brace for 'Unrest' if Donald Trump Wins, Democrats Warn","Americans should prepare for ""unrest' if former President Donald Trump completes the greatest political comeback in modern American politics, Democrats told the Wall Street Journal on Monday.
The post Report: Brace for ‘Unrest’ if Donald Trump Wins, Democrats…"
Trump accuses UK's Labour Party of 'foreign interference',"Labour activists volunteering in the US presidential election amounts to illegal ""contributions"", the complaint alleges."
Geraldo Rivera's Scathing Tweet About That Comedian's Racist Comments At The Trump Rally Are Going Super Viral,"""Never thought I would agree with Geraldo Rivera.""View Entire Post ›"
Trump Vs. Harris Fundraising Race: Harris Takes In $222 Million In September—Far Surpassing Trump,Harris' campaign and affiliated groups have already raised $1 billion since she entered the race.
How Trump and Harris' stances and policy plans on marijuana legalization compare,Both Vice President Kamala Harris and former President Donald Trump have offered their views on legalizing weed.
North Carolina 2024 Trump-Harris Polls: Trump Leads By 3 Points In Latest Survey,Polls show Trump and Harris are in a virtual tie for North Carolina’s 16 electoral college votes.
Georgia 2024 Trump-Harris Polls: New Poll Shows Dead Heat—As GOP Aims To Reclaim State,Biden was the first Democratic presidential candidate to win Georgia since 1992.
Why Outlier Poll Showing Harris Winning Iowa Could Spell Trouble For Trump,"Trump trails Harris by three points, after leading her by four in the group’s September survey."
Elon Musk's influence over Trump is being closely watched by Beijing,"Tech billionaire Elon Musk’s influence over former President Donald Trump could be good news for China, where he has extensive business interests."
Biden Embraces Trump Lawfare: 'We Gotta Lock Him Up',"President Joe Biden let the veil slip during a Thursday stop in New Hampshire.
The post Biden Embraces Trump Lawfare: ‘We Gotta Lock Him Up’ appeared first on Breitbart."
"WATCH: Orthodox Jews Rally for Trump, as Obama Claims Trump Is Antisemitic","Orthodox Jews in the ultra-religious enclave of Monsey, New York, rallied on Sunday for former President Donald Trump -- as former President Barack Obama was telling Jewish voters in Wisconsin that Trump is antisemitic.
The post WATCH: Orthodox Jews Rally for…"
Trump Investigated By Arizona AG Over Gun Comments About Liz Cheney,"Trump suggested Cheney, an outspoken critic of his, should have guns “trained on her face” during a Thursday event in Arizona."
Trump: 'I Will Stop the Suffering and Destruction in Lebanon',"Former President Donald Trump pledged Wednesday to ""stop the suffering and destruction in Lebanon"" if elected.
The post Trump: ‘I Will Stop the Suffering and Destruction in Lebanon’ appeared first on Breitbart."
"Watch Live: Donald Trump Holds Rally in Milwaukee, Wisconsin","Former President Donald Trump speaks to supporters at a rally in Milwaukee, Wisconsin, on Friday, November 1.
The post Watch Live: Donald Trump Holds Rally in Milwaukee, Wisconsin appeared first on Breitbart."
Pinkerton: The Deep State vs. Elon Musk - and Donald Trump,"They’re doing to Elon Musk in 2024 what they did to Mike Flynn in 2017.  Now as then, it’s a direct challenge to the rule of law and to democratic procedure.  And yes, Donald Trump, too, is a target, albeit indirectly.
The post Pinkerton: The Deep State vs. E…"
Trump makes vulgar comment about Arnold Palmer at Pennsylvania rally,"With a little over two weeks until Election Day, Former President Donald Trump began his final pitch to voters in Pennsylvania over the weekend with vulgar remarks about golf legend Arnold Palmer's anatomy. Meanwhile, Vice President Kamala Harris is touting a…"
Harris campaigns in Philadelphia as Trump rallies in New York City,"Vice President Kamala Harris hit several stops at she campaigned across Philadelphia on Sunday. Former President Donald Trump, meanwhile, held a rally at Madison Square Garden. Weijia Jiang has more on the campaigns."
John Kelly says Trump told him more than once that Hitler 'did some good things',"Trump's former chief of staff John Kelly confirmed previous reports that Trump told him Hitler ""did some good things,"" The New York Times reported."
Trump campaign distancing itself from comedian's comments at divisive Madison Square Garden rally,"Former President Donald Trump laid out his vision for America Sunday at a rally in New York's Madison Square Garden. The rally featured offensive remarks from surrogates like comedian Tony Hinchcliffe, who called Puerto Rico an ""island of garbage."" The Trump …"
Trump Media Shares Halted Again For Volatile Trading As Price Falls,Shares of the Truth Social parent have surged this month before a recent selloff.
"Harris, Trump making final pitches for president before Election Day",Vice President Kamala Harris and former President Donald Trump are still hitting battleground states to try to sway any remaining undecided voters. CBS News campaign reporter Aaron Navarro has more on the final Harris campaign stops and Olivia Rinaldi breaks …
Harris And Trump’s Biggest Celebrity Endorsements: Nicky Jam—Who Trump Once Called ‘She’—Pulls His Endorsement Over Puerto Rico Controversy,Puerto Rican singer Nicky Jam previously appeared on stage to support Donald Trump.
Why some CEOs are afraid of publicly criticizing Trump,"As it turns out, politics may just be bad for business, and CEOs are likely concerned about alienating customers and employees."
Nolte: Politico Stops Hiding Desire to See Donald Trump Assassinated,"Nolte: Far-left Politico, a blog dedicated to disinformation and lies, is no longer hiding its desire to see former President Donald Trump assassinated.
The post Nolte: Politico Stops Hiding Desire to See Donald Trump Assassinated appeared first on Breitbart."
Trump continues false claims about FEMA response in North Carolina,"Latest news and live updates on the 2024 campaign as Donald Trump heads to North Carolina and Kamala Harris visits Pennsylvania, Wisconsin and Michigan."
Trump facing bipartisan criticism for Madison Square Garden rally,"Former President Donald Trump is coming under bipartisan criticism for Sunday's rally at Madison Square Garden in New York City, which was marked by racist and crude comments. CBS News' Nikole Killion and Ed O'Keefe have the latest on the backlash."
"Trump uses garbage truck to needle Biden, Harris","Former President Donald Trump climbed inside a garbage truck in Wisconsin Wednesday as he continued to bash President Biden for his ""garbage"" comment. Trump told reporters, ""You can't lead America if you don't love Americans."" CBS News campaign reporter Jake …"
"Trump campaigns on immigration issue, Harris gets a Bush endorsement","Former President Donald Trump delivered remarks in Florida where he focused on the impact of illegal immigration and security at the U.S.-Mexico border. Meanwhile, Barbara Pierce Bush, former President George W. Bush's daughter, endorsed Vice President Kamala…"
Arizona 2024 Trump-Harris Polls: Race Virtually Tied In 2 New Surveys,"President Joe Biden narrowly won the battleground state in 2020 over Trump, who sought to overturn election results in the state."
Final push in 2024 election: Trump and Harris neck-and-neck with 8 days to go,"With Election Day eight days away, the CBS News poll shows a close race between former President Donald Trump and Vice President Kamala Harris. Both candidates delivered closing arguments, with Trump holding a rally at Madison Square Garden, and Harris campai…"
Trump Vs. Harris 2024 Polls: Trump Up In New HarrisX/Forbes Survey—Harris Leads In Another,Most polls indicate a tight race between Donald Trump and Kamala Harris.
Will the Harris-Cheney show persuade anti-Trump Republicans?,The Democratic candidate targeted disaffected Republicans in three of the most contested states.
"Trump invokes economy, public safety and 'China virus' during Asian American rally in Vegas","At his first campaign rally targeting the Asian American and Pacific Islander community this election cycle, former President Donald Trump took the stage Thursday evening in Las Vegas with a speech focused on the economy, public safety and immigration to a gr…"
Ros Atkins on… Would Donald Trump accept defeat?,The BBC's analysis editor examines what happened in 2020 and how the Republican might react if he were to lose again.
Pollster Mark Penn: I’d Rather Be Trump Right Now,"Former adviser and pollster for President Clinton Mark Penn said Sunday on FNC's ""Special Report"" that at this point in the election, he would rather be on the side of former President Donald Trump's team.
The post Pollster Mark Penn: I’d Rather Be Trump Righ…"
Trump says he'll fire special counsel Jack Smith if elected,"Former President Donald Trump told a conservative radio host that if elected, he would immediately fire special counsel Jack Smith, who is prosecuting Trump's efforts to overturn the 2020 election and his holding of classified documents."
Pennsylvania Is This Year’s Most Crucial Swing State—Here’s How Harris Or Trump Could Still Win Tomorrow Without It,The winner in Pennsylvania will most likely take the 2024 election—but either candidate could win without the Keystone State.
"Trump Open To RFK Jr.’s Anti-Water Fluoride Proposal, Doesn’t Rule Out Banning Some Vaccines",Kennedy said Trump’s administration would “advise all U.S. water systems to remove fluoride from public water” on his first day in office.
Joe Rogan Says Trump Interview Faced ‘Issue’ With YouTube Search—Here’s What We Know,Rogan’s latest podcast episode interviewing Donald Trump faced technical difficulties early on. But now Rogan says it has a bigger issue.
Donald Trump’s Net Worth Has Doubled In October To $8 Billion As Trump Media Stock Skyrockets,"Trump’s net worth has largely moved in sync with the stock performance from his media company, which is up more than 200% in October."
"Trump-Harris Push To The White House With US Presidential Odds, Polls And Press Updates On Eve Of Election","Final day and hours ahead of Nov. 5 Election Day for U.S. President. Market update with news, polls, odds & information you can bet on between Donald Trump and Kamala Harris."
"And Just Like That, People Are Trolling Donald Trump With Negative Reviews On THAT McDonald's Yelp Page",Welp. I guess y'all won't be wanting fries with that.View Entire Post ›
Bitcoin Approaches All Time High. What Happens If Trump Wins?,A Trump presidency would embed bitcoin more deeply into the financial system. How would that affect its price?
Stacey Williams goes public with her allegations against Donald Trump,"Thirty-one years after Stacey Williams says she was groped by Donald Trump while Jeffrey Epstein watched, the 56-year-old writer, consultant and former Sports Illustrated swimsuit model went public this week with her allegation."
"CBS News poll finds large gender gap between Harris, Trump supporters","New CBS News polling finds a 21-point gender gap in the presidential race, with Vice President Kamala Harris leading with women by 12 points while former President Donald Trump leading with men by 9 points. CBS News executive director of elections and surveys…"
Trump to appear on Joe Rogan's podcast in latest outreach to young male voters,"Former President Donald Trump will sit with Joe Rogan for a taping of his podcast in Austin, Texas, on Friday, according to two sources familiar with the planning."
"Harris taping interviews, Trump holding roundtable and rally","With exactly two weeks until Election Day, Vice President Kamala Harris is in Washington, D.C., for multiple one-on-one interviews with media outlets. Meanwhile, former President Donald Trump is holding events in North Carolina and Florida. CBS News' Nancy Co…"
Former Model Alleges Trump Groped Her During Trump Tower Visit With Jeffrey Epstein,The accusation was made during a Zoom event hosted by a coalition of sexual assault survivors backing Vice President Kamala Harris in the upcoming election.
Nevada 2024 Trump-Harris Polls: New Survey Is Neck-And-Neck—As Harris Struggles With Latinos,Nevada has voted for Democrats in every presidential election since 2008.
"Biden reacts to racist, offensive comments at Trump Madison Square Garden rally","President Biden cast his ballot in Delaware and reacted to offensive and racist comments made at a Donald Trump rally at Madison Square Garden. Mr. Biden called the comments ""embarrassing"" while speaking to reporters, and he also pressed for an Israel-Hamas c…"
Why Eric Trump Likely Isn’t As Rich As His Siblings,"An executive vice president of the Trump Organization, Eric Trump gets most of his fortune from running his dad’s companies rather than equity in the businesses."
Eye Opener: Trump closing statement includes more violent rhetoric and personal grudges,"At a rally in Pennsylvania on Sunday, former President Donald Trump told supporters that he ""shouldn't have left"" office in 2020 and described Democrats as ""demonic."" Also, music legend Quincy Jones has died at 91. All that and all that matters in today's Eye…"
"Latest news on China's efforts to hack Trump, Vance and Harris campaign",Federal officials say China-backed cybercriminals may be behind efforts to hack phones or networks used by former President Donald Trump and running mate JD Vance. The hackers may have also targeted Vice President Kamala Harris' campaign. CBS News' Nicole Sga…
Pennsylvania 2024 Trump-Harris Polls: Harris Up Nearly 2 Points In Latest Survey,Pennsylvania has voted for 10 of the last 12 White House winners.
JD Vance Tells Rogan He Went Into ‘Fight Or Flight’ Mode After Thinking Trump Was Killed In Assassination Attempt,"Vance made the comments on the “Joe Rogan Experience” podcast, days after Trump appeared for an interview."
Nevada 2024 Trump-Harris Polls: Trump Holds Razor-Thin Advantage—As Harris Struggles With Latinos,Nevada has voted for Democrats in every presidential election since 2008.
Donald Trump’s Net Worth Up $400 Million As Trump Media Shares Surge,Trump Media’s share price has more than doubled since reaching a record low in September.
Liberal Icon Naomi Wolf Endorses Trump: 'He's Being More Inclusive',"Liberal icon and feminist author Naomi Wolf endorsed former President Donald Trump, highlighting how he was ""being more inclusive.""
The post Liberal Icon Naomi Wolf Endorses Trump: ‘He’s Being More Inclusive’ appeared first on Breitbart."
Kamala Harris Has More Billionaires Prominently Backing Her Than Trump—Bloomberg Reportedly Gives Another $50 Million To Help Harris (Updated),Michael Bloomberg's reported commitment to Democrats is up to almost $100 million this cycle.
"China-backed hackers targeted Trump, Vance, sources say","Federal authorities believe China-backed cyber criminals attempted to tap into phones or networks used by former President Donald Trump and Sen. JD Vance, multiple sources familiar with the matter confirmed to CBS News. Scott MacFarlane has more."
